Number,Files,Title
,,Network Configuration Access Control Model
,,The JavaScript Object Notation (JSON) Data Interchange Format
,,Path MTU Discovery for IP version 6
,,"Internet Protocol, Version 6 (IPv6) Specification"
,,Message Disposition Notification
,,Pseudowire Setup and Maintenance Using the Label Distribution Protocol (LDP)
,,Protocol Independent Multicast - Sparse Mode (PIM-SM): Protocol Specification (Revised)
,,A One-Way Loss Metric for IP Performance Metrics (IPPM)
,,A One-Way Delay Metric for IP Performance Metrics (IPPM)
,,Internet Key Exchange Protocol Version 2 (IKEv2)
,,Specification of the IP Flow Information Export (IPFIX) Protocol for the Exchange of Flow Information
,,Extension Mechanisms for DNS (EDNS(0))
,,The Multipart/Report Media Type for the Reporting of Mail System Administrative Messages
,,Message Submission for Mail
,,DomainKeys Identified Mail (DKIM) Signatures
,,Transport Layer Security (TLS) Transport Model for the Simple Network Management Protocol (SNMP)
,,SMTP Service Extension for 8-bit MIME Transport
,,Extensible Provisioning Protocol (EPP) Transport over TCP
,,Extensible Provisioning Protocol (EPP) Contact Mapping
,,Extensible Provisioning Protocol (EPP) Host Mapping
,,Extensible Provisioning Protocol (EPP) Domain Name Mapping
,,Extensible Provisioning Protocol (EPP)
,,Cryptographic Message Syntax (CMS)
,,Transport Security Model for the Simple Network Management Protocol (SNMP)
,,Transport Subsystem for the Simple Network Management Protocol (SNMP)
,,Simple Network Management Protocol (SNMP) Context EngineID Discovery
,,Augmented BNF for Syntax Specifications: ABNF
,,Automated Updates of DNS Security (DNSSEC) Trust Anchors
,,XDR: External Data Representation Standard
,,Internet Control Message Protocol (ICMPv6) for the Internet Protocol Version 6 (IPv6) Specification
,,Uniform Resource Identifier (URI): Generic Syntax 
,," UTF-8, a transformation format of ISO 10646 "
,,DNS Extensions to Support IP Version 6 
,, RTP Profile for Audio and Video Conferences with Minimal Control 
,,RTP: A Transport Protocol for Real-Time Applications 
,, Management Information Base (MIB) for the Simple Network Management Protocol (SNMP) 
,, Transport Mappings for the Simple Network Management Protocol (SNMP) 
,, Version 2 of the Protocol Operations for the Simple Network Management Protocol (SNMP) 
,, View-based Access Control Model (VACM) for the Simple Network Management Protocol (SNMP) 
,, User-based Security Model (USM) for version 3 of the Simple Network Management Protocol (SNMPv3) 
,, Simple Network Management Protocol (SNMP) Applications 
,, Message Processing and Dispatching for the Simple Network Management Protocol (SNMP) 
,, An Architecture for Describing Simple Network Management Protocol (SNMP) Management Frameworks 
,, SMTP Service Extension for Command Pipelining 
,, Remote Network Monitoring Management Information Base 
,, Conformance Statements for SMIv2 
,, Textual Conventions for SMIv2 
,, Structure of Management Information Version 2 (SMIv2) 
,, RIP Version 2 
,, Multiprotocol Interconnect over Frame Relay 
,, OSPF Version 2 
,, A One-Time Password System 
,, Post Office Protocol - Version 3 
,, SMTP Service Extension for Message Size Declaration 
,, SMTP Service Extensions 
RFC 1725,, Post Office Protocol - Version 3 
RFC 1723,, RIP Version 2 - Carrying Additional Information 
,, RIP Version 2 Protocol Applicability Statement 
,, PPP in HDLC-like Framing 
,, The Point-to-Point Protocol (PPP) 
,, Transmission of IP and ARP over FDDI Networks 
,, The TFTP Protocol (Revision 2) 
,,Management Information Base for Network Management of TCP/IP-based internets: MIB-II
,, Concise MIB definitions 
,,The Transmission of IP Datagrams over the SMDS Service
,, Transmitting IP traffic over ARCNET networks 
,, Structure and identification of management information for TCP/IP-based internets 
,, Standard for the transmission of 802.2 packets over IPX networks 
,,Requirements for Internet Hosts - Application and Support 
,, Requirements for Internet Hosts - Communication Layers 
RFC 1119,, Network Time Protocol (version 2) specification and implementation 
,, Host extensions for IP multicasting 
,, Standard for the transmission of IP datagrams over NetBIOS networks 
RFC 1065,, Structure and identification of management information for TCP/IP-based internets 
,, Nonstandard for transmission of IP datagrams over serial lines: SLIP 
,, Internet Protocol on Network System's HYPERchannel: Protocol Specification 
,, Standard for the transmission of IP datagrams over IEEE 802 networks 
,,Domain names - implementation and specification 
,, Domain names - concepts and facilities 
,,ISO Transport Service on top of the TCP Version: 3
,, Protocol standard for a NetBIOS service on a TCP/UDP transport: Detailed specifications 
,, Protocol standard for a NetBIOS service on a TCP/UDP transport: Concepts and methods 
,,File Transfer Protocol 
,, Internet Standard Subnetting Procedure 
,, Broadcasting Internet datagrams in the presence of subnets 
,, Broadcasting Internet Datagrams 
,, Host Access Protocol specification 
,, A Reverse Address Resolution Protocol
,, Standard for the transmission of IP datagrams over experimental Ethernet networks 
,,A Standard for the Transmission of IP Datagrams over Ethernet Networks 
,,DCN Local-Network Protocols
,, Time Protocol 
,, Daytime Protocol 
,, Active users 
,, Quote of the Day Protocol 
,, Character Generator Protocol 
,, Discard Protocol 
,, Echo Protocol 
,, Telnet Extended Options: List Option 
,, Telnet Timing Mark Option 
,, Telnet Status Option 
,, Telnet Suppress Go Ahead Option 
,, Telnet Echo Option 
,, Telnet Binary Transmission 
,, Telnet Option Specifications 
,, Telnet Protocol Specification 
,,An Ethernet Address Resolution Protocol: Or Converting Network Protocol Addresses to 48.bit Ethernet Address for Transmission on Ethernet Hardware
,,STANDARD FOR THE FORMAT OF ARPA INTERNET TEXT MESSAGES
,, Simple Mail Transfer Protocol 
,, Transmission Control Protocol 
,, Internet Control Message Protocol 
,, Internet Protocol 
,, User Datagram Protocol 
,,ASCII format for network interchange 
